{
  "$schema": "http://json-schema.org/draft-07/schema#",
  "$id": "https://github.com/carbondirect/BOOST/schemas/certification_scheme.json",
  "title": "Certification Scheme",
  "type": "object",
  "properties": {
    "schemeId": { "type": "string" },
    "schemeName": { "type": "string" },
    "versionNumber": { "type": "string" },
    "recognitionStatus": {
      "type": "string",
      "enum": [
        "internationally-recognized", "nationally-approved", "pending-approval", "not-recognized"
      ]
    },
    "description": { "type": "string" },
    "website": { "type": "string", "format": "uri" },
    "materialCategories": { "type": "array", "items": { "type": "string" } },
    "controlSystems": { "type": "array", "items": { "type": "string" } },
    "labelUseRequirements": { "type": "string" },
    "volumeTrackingRequirements": { "type": "string" },
    "dueDiligenceRequirements": { "type": "string" },
    "sustainabilityCriteria": { "type": "array", "items": { "type": "string" } },
    "applicableRegions": { "type": "array", "items": { "type": "string" } },
    "dateEstablished": { "type": "string", "format": "date" },
    "lastUpdated": { "type": "string", "format": "date-time" }
  },
  "required": ["schemeId", "schemeName", "versionNumber", "recognitionStatus"]
}